<?xml version="1.0" encoding="UTF-8"?>
<generator dsName="pg"
	xmlns:xsi="http://www.w3.org/2001/XMLSchema-instance"
	xsi:noNamespaceSchemaLocation=".Generator.xsd">

	<url>jdbc:postgresql://114.67.87.80:5432/crawler</url>
	<username>crawler</username>
	<password>crawler@(ddf_^)</password>
	<driverName>org.postgresql.Driver</driverName>

	<module name="sys" package="cn.renlm.crawler">
		<table schema="public" author="任黎明" name="sys_const" />
		<table schema="public" author="任黎明" name="sys_dict" />
		<table schema="public" author="任黎明" name="sys_tree" />
		<table schema="public" author="任黎明" name="sys_file" idType="ASSIGN_ID" />
	</module>
</generator>